{"$schema":"https://json-schema.org/draft/2020-12/schema","type":"object","additionalProperties":false,"required":["review_id","candidate_id","research_id","status","source_review","legal_basis_review","effective_date_review","logic_review","missing_exceptions","unsupported_assertions","required_changes","confidence","human_review_required","reviewed_at"],"properties":{"review_id":{"type":"string"},"candidate_id":{"type":"string"},"research_id":{"type":"string"},"status":{"enum":["APPROVE_FOR_HUMAN_REVIEW","REJECT","NEEDS_CHANGES","HUMAN_REVIEW"]},"source_review":{"type":"object"},"legal_basis_review":{"type":"object"},"effective_date_review":{"type":"object"},"logic_review":{"type":"object"},"missing_exceptions":{"type":"array","items":{"type":"string"}},"unsupported_assertions":{"type":"array","items":{"type":"string"}},"required_changes":{"type":"array","items":{"type":"string"}},"confidence":{"enum":["high","medium","low"]},"human_review_required":{"const":true},"reviewed_at":{"type":"string","format":"date-time"}}}
